{
  "name": "SMART Slot Publisher Specification Repository",
  "organization": "SMART",
  "synthetic": true,
  "baseURL": "https://raw.githubusercontent.com/smart-on-fhir/smart-scheduling-links/master/examples",
  "contacts": [
    {
      "name": "Nick Robison",
      "email": "nicholas.a.robison@omb.eop.gov"
    },
    {
      "name": "Josh Mandel",
      "email": "jmandel@gmail.com"
    }
  ],
  "headers": [
    {
      "name": "CLIENT_ID",
      "value": "test-client-id"
    }
  ],
  "params": [
    {
      "name": "clientid",
      "value": "test-client-id"
    }
  ]
}
